0;I completely agree! I always feel much better after a morning run.;0;0;various_text
1;Me too! It's a great way to wake up.;1;0;purple_department
-2;I completely agree! I always feel much better after a morning run.;0;0;various_text
3;I've been meaning to start running in the morning, thanks for the motivation!;5;0;brief_floor
-4;I prefer to exercise in the evening because I'm not a morning person.;26;0;real_concern
5;That's understandable. It's important to find a time that works for you.;5;0;aggressive_setting
-6;I prefer to exercise in the evening because I'm not a morning person.;26;0;real_concern
7;I used to be the same way, but now I can't imagine starting my day without a run.;4;0;shot_equal
-8;What are some tips for someone who wants to start running in the morning?;45;0;prior_abuse
9;Start slow and gradually increase your distance and speed.;13;0;thin_temperature
-10;What are some tips for someone who wants to start running in the morning?;45;0;prior_abuse
11;Make sure to stretch before and after your run.;6;0;rough_exam
-12;What are some tips for someone who wants to start running in the morning?;45;0;prior_abuse
13;Invest in good running shoes.;6;0;working_evidence
-14;Does running in the morning really help with weight loss?;7;0;training_father
15;Yes, it can help to boost your metabolism and burn calories throughout the day.;4;0;complete_battle
-16;Does running in the morning really help with weight loss?;7;0;training_father
17;However, it's important to pair running with a healthy diet for optimal weight loss.;8;0;pure_bank
-18;I don't have time to run in the morning. How long does a typical morning run take?;5;0;best_inflation
19;It can vary depending on your fitness level and the distance you choose to run. But generally, a 30-minute run is a good starting point.;0;0;positive_row
-20;I don't have time to run in the morning. How long does a typical morning run take?;5;0;best_inflation
21;Even a short 10-15 minute run can be beneficial.;2;0;spiritual_buddy
-22;What are some good stretches to do before a morning run?;3;0;suitable_pound
23;Hip flexor stretch, hamstring stretch, quad stretch, calf stretch.;3;0;wild_heart
-24;What are some good stretches to do before a morning run?;3;0;suitable_pound
25;Don't forget to warm up with a light jog or walk before stretching.;22;0;minor_surprise
-26;I tried running in the morning once, but it made me feel really tired throughout the day.;12;0;sick_mate
27;It's possible that you started too fast or didn't hydrate enough. Give it another try and see if you can adjust.;25;0;ordinary_iron
-28;I tried running in the morning once, but it made me feel really tired throughout the day.;12;0;sick_mate
29;It's not for everyone, but it's worth experimenting with different times of day to find what works best for you.;2;0;best_death
-30;I'm glad you enjoyed your first skiing experience. What was the most challenging part?;24;1;capable_cash
31;The most challenging part for me was trying to keep my balance and not falling over.;0;1;odd_number
-32;I'm glad you enjoyed your first skiing experience. What was the most challenging part?;24;1;capable_cash
33;For me, it was trying to get up after falling down.;4;1;acceptable_temperature
-34;I've been skiing for years, and it's still one of my favorite things to do. Do you plan on going skiing again?;1;1;wise_guitar
35;Yes, I definitely plan on going skiing again. It was so much fun!;2;1;intelligent_upstairs
-36;I've been skiing for years, and it's still one of my favorite things to do. Do you plan on going skiing again?;1;1;wise_guitar
37;No, I don't think skiing is for me. It was too cold and difficult.;10;1;practical_birth
-38;Did you take any skiing lessons or did you learn on your own?;6;1;desperate_video
39;I took a few lessons to learn the basics.;1;1;super_village
-40;Did you take any skiing lessons or did you learn on your own?;6;1;desperate_video
41;I learned from my friends who are experienced skiers.;16;1;vast_claim
-42;I've always wanted to try skiing, but I'm afraid of getting hurt. Were you scared?;7;1;impressive_potato
43;Yes, I was scared at first, but I quickly overcame my fear and started having fun.;15;1;wild_radio
-44;I've always wanted to try skiing, but I'm afraid of getting hurt. Were you scared?;7;1;impressive_potato
45;I was a bit nervous, but the instructors were very helpful and made me feel safe.;2;1;sufficient_agency
-46;What other winter sports have you tried?;4;1;emergency_function
47;I haven't tried any other winter sports yet, but I'm open to trying new things.;4;1;spare_whole
-48;What other winter sports have you tried?;4;1;emergency_function
49;I've tried snowboarding before, but I prefer skiing.;7;1;complex_economics
-50;I'm not really into winter sports, but your post makes me want to give skiing a try.;15;1;conscious_business
51;You should definitely try it! It's a great way to enjoy the winter weather.;3;1;former_repeat
-52;I'm not really into winter sports, but your post makes me want to give skiing a try.;15;1;conscious_business
53;If you do try it, make sure to take some lessons to avoid injuries.;15;1;thick_kind
-54;Do you think skiing is an expensive hobby?;10;1;overall_insect
55;It can be expensive, especially if you need to rent equipment and buy lift tickets.;13;1;fair_comfort
-56;Do you think skiing is an expensive hobby?;10;1;overall_insect
57;Yes, it can be expensive, but there are ways to save money, like buying used equipment or skiing on weekdays instead of weekends.;4;1;plastic_clue
-58;I used to hate running, but I recently started and now I can't get enough. Do you have any tips for beginners?;9;2;equal_edge
59;Start slow and build up your endurance gradually.;13;2;working_pollution
-60;I used to hate running, but I recently started and now I can't get enough. Do you have any tips for beginners?;9;2;equal_edge
61;Invest in a good pair of running shoes.;0;2;suspicious_contact
-62;I used to hate running, but I recently started and now I can't get enough. Do you have any tips for beginners?;9;2;equal_edge
63;Find a running partner for motivation.;9;2;late_housing
-64;I prefer team sports like basketball or soccer. Do you ever play team sports or just stick to running?;13;2;remote_appearance
65;I occasionally play basketball, but running is my main sport.;0;2;apart_pot
-66;I prefer team sports like basketball or soccer. Do you ever play team sports or just stick to running?;13;2;remote_appearance
67;I like team sports too, but running is more convenient for me.;12;2;top_tale
-68;I'm not much of a runner, but I do enjoy hiking. Have you ever gone on any scenic runs?;14;2;particular_personality
69;Yes! Running through the mountains or along the beach is amazing.;7;2;tight_classic
-70;I'm not much of a runner, but I do enjoy hiking. Have you ever gone on any scenic runs?;14;2;particular_personality
71;I haven't done any scenic runs yet, but it's on my bucket list.;2;2;left_many
-72;I heard running can be hard on your joints. Have you ever experienced any injuries?;0;2;brilliant_bathroom
73;I've had some minor injuries, but nothing too serious. Stretching before and after runs helps prevent injuries.;2;2;glad_current
-74;I heard running can be hard on your joints. Have you ever experienced any injuries?;0;2;brilliant_bathroom
75;I've been lucky and haven't had any injuries yet.;10;2;then_election
-76;I'm thinking about training for a marathon. Have you ever run one?;22;2;objective_population
77;Yes! It was a challenging but rewarding experience.;20;2;initial_male
-78;I'm thinking about training for a marathon. Have you ever run one?;22;2;objective_population
79;I haven't run a marathon yet, but it's a goal of mine.;5;2;square_guess
-80;I wish I had the motivation to run regularly. How do you stay motivated?;17;2;select_suggestion
81;I set goals for myself and track my progress.;6;2;street_north
-82;I wish I had the motivation to run regularly. How do you stay motivated?;17;2;select_suggestion
83;Listening to music or podcasts while running helps me stay motivated.;13;2;wide_illegal
-84;I wish I had the motivation to run regularly. How do you stay motivated?;17;2;select_suggestion
85;I signed up for a race to hold myself accountable.;6;2;suitable_instance
-86;Congratulations! That's quite an achievement. How did you prepare for the marathon?;8;3;which_ruin
87;Thank you! I followed a 16-week training plan that included a mix of long runs, speed work, and cross training.;6;3;sorry_glove
-88;Congratulations! That's quite an achievement. How did you prepare for the marathon?;8;3;which_ruin
89;I also made sure to eat a balanced diet and get enough rest.;2;3;money_influence
-90;I've always wanted to run a marathon, but I'm not sure if I have what it takes. Do you have any tips for beginners?;10;3;crazy_permit
91;Absolutely! Start with a half marathon to build up your endurance, and don't forget to cross train to avoid injury.;8;3;latter_beach
-92;I've always wanted to run a marathon, but I'm not sure if I have what it takes. Do you have any tips for beginners?;10;3;crazy_permit
93;Also, remember to pace yourself during the race and fuel properly with water and energy gels.;14;3;direct_grab
-94;Running a marathon sounds really daunting to me. What motivated you to take on the challenge?;42;3;waste_assignment
95;I wanted to push myself out of my comfort zone and see what I was capable of.;13;3;prior_application
-96;Running a marathon sounds really daunting to me. What motivated you to take on the challenge?;42;3;waste_assignment
97;Plus, the sense of community and support among the runners was really inspiring.;1;3;select_neat
-98;Did you run with a group or solo?;24;3;upset_appointment
99;I ran with a group of friends who were also training for the marathon.;2;3;more_editor
-100;Did you run with a group or solo?;24;3;upset_appointment
101;It was great to have their support and encouragement throughout the race.;0;3;poor_girl
-102;What was the most difficult part of the marathon for you?;5;3;angry_kitchen
103;Definitely the last few miles. My legs were tired and my energy was starting to fade.;11;3;motor_cap
-104;What was the most difficult part of the marathon for you?;5;3;angry_kitchen
105;But I kept reminding myself of all the hard work I had put in and pushed through to the finish line.;7;3;each_brain
-106;I really enjoy playing video games in my free time. It helps me unwind after a long day at work.;22;4;wild_minimum
107;What kind of games do you like to play?;10;4;common_spend
-108;I really enjoy playing video games in my free time. It helps me unwind after a long day at work.;22;4;wild_minimum
109;I've been playing a lot of RPGs lately.;1;4;gross_tower
-110;I love hiking and being outdoors. There's nothing quite like the feeling of being surrounded by nature.;33;4;lost_equal
111;Where is your favorite place to go hiking?;26;4;remote_phone
-112;I love hiking and being outdoors. There's nothing quite like the feeling of being surrounded by nature.;33;4;lost_equal
113;I'm more of a beach person myself.;12;4;sick_mountain
-114;I'm really into painting and drawing. It's a great way for me to express myself and unwind.;4;4;amazing_hide
115;Do you have any favorite artists?;4;4;senior_sample
-116;I'm really into painting and drawing. It's a great way for me to express myself and unwind.;4;4;amazing_hide
117;Have you ever sold any of your paintings?;24;4;aggressive_term
-118;I enjoy playing musical instruments in my free time. It's a great way to relax and express myself creatively.;14;4;proof_lift
119;What kind of instruments do you play?;17;4;joint_gather
-120;I enjoy playing musical instruments in my free time. It's a great way to relax and express myself creatively.;14;4;proof_lift
121;I wish I was musically talented.;0;4;remote_drawing
-122;I love practicing yoga and meditation. It helps me clear my mind and stay centered.;10;4;clear_neck
123;Do you practice every day?;5;4;educational_audience
-124;I love practicing yoga and meditation. It helps me clear my mind and stay centered.;10;4;clear_neck
125;Have you noticed any benefits to your mental health?;4;4;slight_prompt
-126;I really enjoy playing board games with my friends and family. It's a great way to bond and have fun together.;12;4;forward_sail
127;What's your favorite board game?;6;4;emotional_drink
-128;I really enjoy playing board games with my friends and family. It's a great way to bond and have fun together.;12;4;forward_sail
129;I've never been much of a board game person, but maybe I should try it out.;20;4;alternative_profit
-130;I like to collect stamps and coins from all around the world. It's a fun way to learn about different cultures.;3;4;ugly_effect
131;How many countries have you collected stamps from?;6;4;character_rope
-132;I like to collect stamps and coins from all around the world. It's a fun way to learn about different cultures.;3;4;ugly_effect
133;What's the most interesting coin you've ever found?;19;4;less_associate
-134;I totally agree. I always feel so much better when I get a good night's sleep.;10;5;conscious_breast
135;Me too!;2;5;sure_poet
-136;I totally agree. I always feel so much better when I get a good night's sleep.;10;5;conscious_breast
137;Same here.;11;5;status_tear
-138;I totally agree. I always feel so much better when I get a good night's sleep.;10;5;conscious_breast
139;Getting a good night's sleep makes all the difference.;0;5;familiar_guess
-140;It's so hard to get a good night's sleep sometimes, though. Do you have any tips?;23;5;odd_fire
141;I try to stick to a regular sleep schedule.;12;5;appropriate_economy
-142;It's so hard to get a good night's sleep sometimes, though. Do you have any tips?;23;5;odd_fire
143;Avoiding caffeine before bed helps me.;19;5;financial_counter
-144;It's so hard to get a good night's sleep sometimes, though. Do you have any tips?;23;5;odd_fire
145;I find that reading a book before bed helps me relax and fall asleep easier.;1;5;few_principle
-146;I heard that screens can interfere with sleep. Do you think it's true?;2;5;relative_month
147;Yes, it's definitely true. Blue light emitted by screens can disrupt our circadian rhythm and make it harder to fall asleep.;5;5;yellow_dear
-148;I heard that screens can interfere with sleep. Do you think it's true?;2;5;relative_month
149;That's why I always try to avoid screens before bed.;10;5;aggressive_secretary
-150;What about napping? Is it good for you?;22;5;easy_knife
151;It depends on the person. Some people benefit from napping, while others find it disrupts their sleep schedule.;0;5;present_city
-152;What about napping? Is it good for you?;22;5;easy_knife
153;Personally, I only nap if I'm really tired and have the time for it.;7;5;close_author
-154;I have trouble falling asleep no matter what I do. What should I do?;25;5;stock_time
155;You might want to talk to your doctor about it. There could be an underlying medical issue causing your sleep problems.;0;5;airline_change
-156;I have trouble falling asleep no matter what I do. What should I do?;25;5;stock_time
157;Some people find that meditation or relaxation techniques help them fall asleep easier.;6;5;front_magazine
-158;What about sleeping pills? Are they a good option?;3;5;wise_screw
159;It's best to talk to your doctor before taking any medication for sleep. Sleeping pills can be habit-forming and come with side effects.;6;5;leading_media
-160;What about sleeping pills? Are they a good option?;3;5;wise_screw
161;I try to avoid sleeping pills unless absolutely necessary.;10;5;brief_discussion
-162;I think I sleep too much. Is that possible?;23;5;constant_mountain
163;Yes, it's possible to oversleep. It can leave you feeling groggy and lethargic.;7;5;individual_passenger
-164;I think I sleep too much. Is that possible?;23;5;constant_mountain
165;The recommended amount of sleep for adults is 7-9 hours per night. If you're sleeping more than that and still feeling tired, you might want to talk to your doctor.;15;5;hour_shop
-166;I completely agree. What language are you learning?;20;6;front_she
167;I'm learning Spanish.;10;6;effective_wedding
-168;I completely agree. What language are you learning?;20;6;front_she
169;I'm learning French.;9;6;ugly_zone
-170;I completely agree. What language are you learning?;20;6;front_she
171;I'm learning Mandarin.;7;6;mother_discipline
-172;I completely agree. What language are you learning?;20;6;front_she
173;I'm learning German.;13;6;drunk_diamond
-174;I've been thinking about learning a second language, but I'm not sure which one to choose.;43;6;hour_quantity
175;What are your interests?;4;6;north_special
-176;I've been thinking about learning a second language, but I'm not sure which one to choose.;43;6;hour_quantity
177;What language do you think will be most useful for you?;1;6;sorry_leave
-178;I've been thinking about learning a second language, but I'm not sure which one to choose.;43;6;hour_quantity
179;Consider the cultures you're interested in.;4;6;accurate_anger
-180;I already speak two languages, but I'm thinking about learning a third one. Do you have any tips?;2;6;secret_thanks
181;Try to immerse yourself in the language as much as possible.;4;6;least_pizza
-182;I already speak two languages, but I'm thinking about learning a third one. Do you have any tips?;2;6;secret_thanks
183;Find a language exchange partner.;5;6;sensitive_land
-184;I already speak two languages, but I'm thinking about learning a third one. Do you have any tips?;2;6;secret_thanks
185;Take a class or use a language learning app.;0;6;last_joke
-186;I already speak two languages, but I'm thinking about learning a third one. Do you have any tips?;2;6;secret_thanks
187;Read books or watch movies in the target language.;4;6;boring_city
-188;I've been learning a second language for a few months now, but I'm not making much progress. Any advice?;24;6;long_battle
189;Practice every day, even if it's just for a few minutes.;14;6;each_most
-190;I've been learning a second language for a few months now, but I'm not making much progress. Any advice?;24;6;long_battle
191;Try to use the language in real-life situations.;7;6;powerful_individual
-192;I've been learning a second language for a few months now, but I'm not making much progress. Any advice?;24;6;long_battle
193;Don't be afraid to make mistakes.;7;6;creative_while
-194;I've been learning a second language for a few months now, but I'm not making much progress. Any advice?;24;6;long_battle
195;Find a tutor or language partner for extra support.;0;6;glad_negative
-196;I'm a native English speaker, so I've never really had to learn another language. Is it really that important?;17;6;plenty_inspector
197;Yes, it can broaden your horizons and give you a new perspective on the world.;13;6;annual_virus
-198;I'm a native English speaker, so I've never really had to learn another language. Is it really that important?;17;6;plenty_inspector
199;Learning a new language can also make travel more enjoyable and rewarding.;13;6;constant_dirt
-200;I'm a native English speaker, so I've never really had to learn another language. Is it really that important?;17;6;plenty_inspector
201;It's a great way to meet new people and make friends.;11;6;small_beyond
-202;I'm a native English speaker, so I've never really had to learn another language. Is it really that important?;17;6;plenty_inspector
203;It can even delay the onset of dementia and Alzheimer's.;0;6;distinct_criticism
-204;I've been learning a second language for a while now, but I'm still struggling with grammar. Any tips?;4;6;extra_hotel
205;Focus on mastering one grammar point at a time.;3;6;comprehensive_lock
-206;I've been learning a second language for a while now, but I'm still struggling with grammar. Any tips?;4;6;extra_hotel
207;Read grammar explanations and examples multiple times.;0;6;tiny_support
-208;I've been learning a second language for a while now, but I'm still struggling with grammar. Any tips?;4;6;extra_hotel
209;Practice using the grammar point in different contexts.;4;6;common_start
-210;I've been learning a second language for a while now, but I'm still struggling with grammar. Any tips?;4;6;extra_hotel
211;Get feedback from a teacher or language partner.;10;6;business_calendar
-212;I'm interested in learning a language, but I don't have a lot of money. How can I learn without spending a lot?;32;6;unable_interview
213;Use free language learning apps like Duolingo or Memrise.;1;6;exciting_reason
-214;I'm interested in learning a language, but I don't have a lot of money. How can I learn without spending a lot?;32;6;unable_interview
215;Watch language learning videos on YouTube.;9;6;party_silver
-216;I'm interested in learning a language, but I don't have a lot of money. How can I learn without spending a lot?;32;6;unable_interview
217;Find language exchange partners online.;1;6;aggressive_departure
-218;I'm interested in learning a language, but I don't have a lot of money. How can I learn without spending a lot?;32;6;unable_interview
219;Use free resources from the library or online.;12;6;leather_present
-220;That sounds amazing! Could you share the recipe with me?;1;7;smooth_ruin
221;Sure, I'd be happy to share it with you!;8;7;level_display
-222;That sounds amazing! Could you share the recipe with me?;1;7;smooth_ruin
223;I'm also interested in the recipe. Please share!;1;7;comprehensive_bone
-224;I'm not a big fan of pasta, but I'm glad you enjoyed it.;22;7;content_quit
225;What's your favorite dish then?;12;7;green_bear
-226;I'm not a big fan of pasta, but I'm glad you enjoyed it.;22;7;content_quit
227;I personally love pasta. Do you have any other favorite dishes?;9;7;separate_bat
-228;I've been trying to improve my cooking skills lately. Any tips for a beginner?;10;7;lucky_addition
229;Start with simple recipes and don't be afraid to make mistakes.;5;7;incident_habit
-230;I've been trying to improve my cooking skills lately. Any tips for a beginner?;10;7;lucky_addition
231;Invest in good quality cooking tools and ingredients.;4;7;airline_lunch
-232;I've been trying to improve my cooking skills lately. Any tips for a beginner?;10;7;lucky_addition
233;Watch cooking tutorials on YouTube for inspiration and guidance.;5;7;purple_choice
-234;I'm a vegetarian. Was the recipe vegetarian-friendly?;4;7;cold_lady
235;Yes, it was actually a vegetarian recipe.;7;7;car_clerk
-236;I'm a vegetarian. Was the recipe vegetarian-friendly?;4;7;cold_lady
237;You can easily make it vegan by substituting dairy products with plant-based alternatives.;10;7;cold_plate
-238;I don't have much time to cook. Do you have any quick and easy recipes to recommend?;20;7;west_shift
239;Stir-fry dishes are usually quick and easy to make. You can also try making a sandwich or wrap with your favorite ingredients.;6;7;constant_average
-240;I don't have much time to cook. Do you have any quick and easy recipes to recommend?;20;7;west_shift
241;Try making a simple salad with pre-cut veggies and store-bought dressing.;2;7;economy_chemistry
-242;I've been meaning to try meditation, but I don't know where to start. Any tips?;37;8;wrong_estate
243;There are many apps that can guide you through a meditation practice, like Headspace or Calm.;14;8;fit_ladder
-244;I've been meaning to try meditation, but I don't know where to start. Any tips?;37;8;wrong_estate
245;You can also try searching for guided meditations on YouTube or Spotify.;1;8;royal_hour
-246;I've been meaning to try meditation, but I don't know where to start. Any tips?;37;8;wrong_estate
247;Start with just a few minutes a day and work your way up.;2;8;odd_sign
-248;I've been meaning to try meditation, but I don't know where to start. Any tips?;37;8;wrong_estate
249;Find a quiet, comfortable place to meditate where you won't be disturbed.;2;8;high_earth
-250;I've tried meditation before, but I always get distracted. How do you stay focused?;0;8;dependent_share
251;It's normal to get distracted during meditation. When you notice your mind wandering, simply acknowledge the thought and bring your focus back to your breath or mantra.;0;8;south_stroke
-252;I've tried meditation before, but I always get distracted. How do you stay focused?;0;8;dependent_share
253;Try to practice at the same time and place every day to build a habit.;8;8;creative_wonder
-254;I've tried meditation before, but I always get distracted. How do you stay focused?;0;8;dependent_share
255;Don't judge yourself for getting distracted - meditation is a practice and it takes time to get better at it.;7;8;straight_problem
-256;I've tried meditation before, but I always get distracted. How do you stay focused?;0;8;dependent_share
257;You can also try using a guided meditation or focusing on a specific object or sensation.;8;8;practical_today
-258;I've heard that meditation can be religious. Is that true?;16;8;fast_government
259;While some forms of meditation have roots in religious traditions, meditation itself is not inherently religious.;10;8;dear_bat
-260;I've heard that meditation can be religious. Is that true?;16;8;fast_government
261;Many people practice secular forms of meditation that focus on mindfulness and self-awareness.;10;8;enough_blood
-262;I've heard that meditation can be religious. Is that true?;16;8;fast_government
263;You can choose a type of meditation that aligns with your personal beliefs and values.;8;8;quick_court
-264;I've heard that meditation can be religious. Is that true?;16;8;fast_government
265;It's important to remember that meditation is a personal practice, and you can make it your own.;7;8;educational_client
-266;Can meditation really help with anxiety and depression?;17;8;another_concept
267;Yes, studies have shown that regular meditation can reduce symptoms of anxiety and depression.;4;8;waste_mobile
-268;Can meditation really help with anxiety and depression?;17;8;another_concept
