1579;I was only there for a few days, but I managed to fit in a few museums, a boat tour, and a visit to a local park.;0;53;secure_due
-1580;Do you plan on traveling to other cities soon, or was this a one-time thing?;25;53;mental_notice
1581;Definitely! I'm already planning my next trip to Japan.;7;53;proof_ratio
-1582;Do you plan on traveling to other cities soon, or was this a one-time thing?;25;53;mental_notice
1583;I'm not sure yet, but I definitely want to travel more in the future.;13;53;plane_poetry
-1584;Congratulations on finishing your first marathon! What was your training schedule like?;0;54;weekly_resort
1585;Thank you! I followed a 16-week training plan that consisted of running 4 times a week with increasing mileage each week.;2;54;every_national
-1586;Congratulations on finishing your first marathon! What was your training schedule like?;0;54;weekly_resort
1587;I did a similar training plan and it really helped me prepare.;4;54;straight_balance
-1588;That's amazing! How did you feel during the marathon?;9;54;apart_pair
1589;I felt great for the first half, but started to feel tired around mile 20. I had to push myself to keep going, but the cheering crowds really helped!;6;54;original_tie
-1590;That's amazing! How did you feel during the marathon?;9;54;apart_pair
1591;I had a tough time during the marathon but seeing other runners push through their pain really motivated me to keep going.;18;54;wide_significance
-1592;Wow, a marathon is a huge accomplishment. What are your future running goals?;24;54;fine_throat
1593;I want to improve my time and try to qualify for the Boston Marathon.;17;54;little_bench
-1594;Wow, a marathon is a huge accomplishment. What are your future running goals?;24;54;fine_throat
1595;My goal is to complete an ultramarathon. It's a long-term goal, but I'm excited to work towards it.;0;54;upper_stick
-1596;Wow, a marathon is a huge accomplishment. What are your future running goals?;24;54;fine_throat
1597;I want to run a marathon in every state in the US.;6;54;many_shape
-1598;Running a marathon can be tough on the body. Did you experience any injuries or soreness?;6;54;wine_belt
1599;I had some minor knee pain during training, but I made sure to rest and stretch. After the marathon, my legs were sore but nothing too serious.;8;54;low_dark
-1600;Running a marathon can be tough on the body. Did you experience any injuries or soreness?;6;54;wine_belt
1601;I had a lot of blisters on my feet, but they eventually healed. The soreness was intense but I made sure to take care of my body with rest and hydration.;1;54;inevitable_flower
-1602;I've always wanted to run a marathon but I don't know where to start. Any tips?;35;54;substantial_board
1603;Find a training plan that works for you and stick to it. Don't be afraid to rest and listen to your body. Also, make sure to fuel properly before and during the race.;4;54;dress_homework
-1604;I've always wanted to run a marathon but I don't know where to start. Any tips?;35;54;substantial_board
1605;Start with a 5K or 10K race and work your way up to a marathon. It takes time and dedication, but it's worth it in the end.;2;54;brown_reserve
-1606;I've been meditating for a while now, and it has helped me a lot with anxiety and stress. What did you think of it?;39;55;lost_newspaper
1607;I found it difficult to focus at first, but it got better with time.;16;55;solid_safe
-1608;I've been meditating for a while now, and it has helped me a lot with anxiety and stress. What did you think of it?;39;55;lost_newspaper
1609;I felt more relaxed after the session.;3;55;sick_soft
-1610;I've been meditating for a while now, and it has helped me a lot with anxiety and stress. What did you think of it?;39;55;lost_newspaper
1611;I'm not sure if I did it right, but I enjoyed it anyway.;8;55;mad_chain
-1612;I've never tried it, but I've heard it's great for your mental health.;21;55;realistic_red
1613;It definitely is. You should give it a try sometime!;3;55;expensive_counter
-1614;I've never tried it, but I've heard it's great for your mental health.;21;55;realistic_red
1615;It's worth a shot if you're feeling stressed or anxious.;13;55;particular_farmer
-1616;I've tried meditation before, but I just can't seem to sit still for more than a few minutes.;12;55;extreme_vegetable
1617;It can take some practice to build up your focus and endurance.;1;55;lonely_shake
-1618;I've tried meditation before, but I just can't seem to sit still for more than a few minutes.;12;55;extreme_vegetable
1619;You could try guided meditations or starting with shorter sessions.;2;55;logical_wrap
-1620;I'm interested in trying it too. Do you have any tips for beginners?;4;55;international_shift
1621;Start with just a few minutes a day and gradually increase the duration.;5;55;safe_mixture
-1622;I'm interested in trying it too. Do you have any tips for beginners?;4;55;international_shift
1623;Find a quiet and comfortable space to meditate.;24;55;informal_notice
-1624;I'm interested in trying it too. Do you have any tips for beginners?;4;55;international_shift
1625;Focus on your breath and try to let go of distracting thoughts.;4;55;political_inflation
-1626;I've heard that meditation can improve your creativity. Have you noticed any changes in that area?;8;55;beautiful_local
1627;Yes, I've found that I'm more open to new ideas and perspectives.;3;55;mountain_anywhere
-1628;I've heard that meditation can improve your creativity. Have you noticed any changes in that area?;8;55;beautiful_local
1629;It can definitely help with clearing your mind and getting into a creative flow.;4;55;natural_prize
-1630;Do you think meditation is something you'll continue to do regularly?;3;55;think_sink
1631;Absolutely, it has become a part of my daily routine.;15;55;wrong_estate
-1632;Do you think meditation is something you'll continue to do regularly?;3;55;think_sink
1633;I think it's worth making time for, even if it's just a few minutes a day.;0;55;busy_idea
-1634;I'm skeptical of meditation's benefits. Can you convince me otherwise?;0;55;royal_hour
1635;I think it's best to try it for yourself and see how you feel.;3;55;additional_oven
-1636;I'm skeptical of meditation's benefits. Can you convince me otherwise?;0;55;royal_hour
1637;There's plenty of research to support its benefits, but ultimately it's up to you to decide if it's worth pursuing.;13;55;exact_beautiful
-1638;I love hiking too! What mountain did you go to?;2;56;smooth_stable
1639;I went to Mount Washington in New Hampshire.;7;56;personal_organization
-1640;I love hiking too! What mountain did you go to?;2;56;smooth_stable
1641;Oh, I've been there before. It's beautiful!;10;56;pretty_group
-1642;I'm afraid of heights. Did you feel scared at any point?;9;56;otherwise_sector
1643;I was a little scared when we were hiking along the narrow paths.;15;56;fast_university
-1644;I'm afraid of heights. Did you feel scared at any point?;9;56;otherwise_sector
1645;I was a bit nervous at first, but I got used to it.;1;56;top_wake
-1646;I'm afraid of heights. Did you feel scared at any point?;9;56;otherwise_sector
1647;I was scared during the climb, but once we reached the top, it was worth it.;3;56;double_county
-1648;I've never been hiking before, but it sounds like a lot of fun. Do you have any tips for beginners?;12;56;more_plastic
1649;Make sure to wear comfortable shoes and bring enough water.;2;56;agent_big
-1650;I've never been hiking before, but it sounds like a lot of fun. Do you have any tips for beginners?;12;56;more_plastic
1651;Start with easy trails and work your way up.;10;56;both_red
-1652;I've never been hiking before, but it sounds like a lot of fun. Do you have any tips for beginners?;12;56;more_plastic
1653;Hiking poles can be helpful to maintain balance.;8;56;acceptable_camp
-1654;Did you see any wildlife during your hike?;14;56;east_aspect
1655;I saw a family of deer!;1;56;commercial_commercial
-1656;Did you see any wildlife during your hike?;14;56;east_aspect
1657;We saw a black bear in the distance.;11;56;crazy_sex
-1658;Did you see any wildlife during your hike?;14;56;east_aspect
1659;We saw a lot of squirrels and chipmunks.;3;56;immediate_variety
-1660;What was your favorite part of the hike?;3;56;incident_draft
1661;The view from the top was absolutely breathtaking.;9;56;serious_mud
-1662;What was your favorite part of the hike?;3;56;incident_draft
1663;I loved walking through the forest and listening to the sounds of nature.;2;56;wise_yesterday
-1664;Did you take any pictures during your hike?;16;56;suitable_due
1665;Yes, I took a lot of pictures of the scenery.;7;56;able_home
-1666;Did you take any pictures during your hike?;16;56;suitable_due
1667;I wish I had brought a better camera to capture the beauty of the mountains.;1;56;brilliant_historian
-1668;That's great! What kind of music do you like to play?;8;57;helpful_local
1669;I enjoy playing classical pieces like Beethoven and Chopin.;8;57;wise_yesterday
-1670;That's great! What kind of music do you like to play?;8;57;helpful_local
1671;I prefer to play more contemporary pieces.;10;57;final_rate
-1672;I have also been learning to play the piano for a while now. Do you have any tips for staying motivated?;38;57;ago_conversation
1673;Try to set small goals for yourself and celebrate each achievement.;12;57;rare_time
-1674;I have also been learning to play the piano for a while now. Do you have any tips for staying motivated?;38;57;ago_conversation
1675;Don't be too hard on yourself if you make mistakes.;4;57;huge_point
-1676;I have also been learning to play the piano for a while now. Do you have any tips for staying motivated?;38;57;ago_conversation
1677;Find pieces that you enjoy playing and that challenge you.;7;57;appropriate_career
-1678;I have been thinking about taking up the piano as well, but I'm not sure if I have the time. How much time do you spend practicing each day?;11;57;head_throat
1679;I try to practice for at least an hour every day, but sometimes I practice for longer.;1;57;live_bus
-1680;I have been thinking about taking up the piano as well, but I'm not sure if I have the time. How much time do you spend practicing each day?;11;57;head_throat
1681;It's important to find a routine that works for you.;1;57;scared_sell
-1682;Playing the piano seems really difficult. Do you think it's worth the effort?;18;57;frequent_parking
1683;Absolutely! Learning to play an instrument is a valuable skill that can bring you a lot of joy.;2;57;working_media
-1684;Playing the piano seems really difficult. Do you think it's worth the effort?;18;57;frequent_parking
1685;It may be challenging, but the sense of accomplishment you feel when you master a piece is incredible.;4;57;beautiful_deal
-1686;Do you think it's ever too late to start learning to play the piano?;8;57;ordinary_tonight
1687;It's never too late to start learning something new!;7;57;clear_style
-1688;Do you think it's ever too late to start learning to play the piano?;8;57;ordinary_tonight
1689;Learning to play the piano can be a great way to keep your mind active as you get older.;3;57;legal_office
-1690;I agree with you, reading is really helpful. What type of books do you like to read?;7;58;most_deal
1691;I enjoy reading self-help books and biographies.;1;58;nasty_miss
-1692;I agree with you, reading is really helpful. What type of books do you like to read?;7;58;most_deal
1693;I love reading novels and short stories.;18;58;afraid_push
-1694;I agree with you, reading is really helpful. What type of books do you like to read?;7;58;most_deal
1695;I mostly read books about science and technology.;1;58;inevitable_thanks
-1696;I don't really like reading. It's boring and takes up too much time.;15;58;independent_author
1697;Have you tried reading a book that really interests you?;8;58;leather_present
-1698;I don't really like reading. It's boring and takes up too much time.;15;58;independent_author
1699;Reading can actually save time by improving your productivity and focus.;3;58;street_police
-1700;Reading is great, but it's hard to find time for it with a busy schedule.;3;58;upset_series
1701;You can try setting aside just 10-15 minutes a day for reading.;3;58;cheap_end
-1702;Reading is great, but it's hard to find time for it with a busy schedule.;3;58;upset_series
1703;Audiobooks are a great option for busy people.;3;58;visual_brain
-1704;I find it hard to concentrate while reading. Any tips?;20;58;gross_summer
1705;Try reading in a quiet and comfortable place.;2;58;green_kick
-1706;I find it hard to concentrate while reading. Any tips?;20;58;gross_summer
1707;Take breaks every 20-30 minutes to rest your eyes and brain.;3;58;bitter_version
-1708;I prefer watching movies or TV shows instead of reading.;26;58;cheap_food
1709;That's okay, everyone has their own preferences.;2;58;old_marketing
-1710;I prefer watching movies or TV shows instead of reading.;26;58;cheap_food
1711;Reading and watching can both be enjoyable and beneficial.;12;58;simple_hire
-1712;Reading is good, but I don't have much money to spend on books.;37;58;hard_bank
1713;You can borrow books from your local library for free.;21;58;fresh_feeling
-1714;Reading is good, but I don't have much money to spend on books.;37;58;hard_bank
1715;E-books are often cheaper than physical books.;14;58;remote_ship
-1716;I love reading, and I'm always looking for new books to read. Can you recommend any good ones?;22;58;desperate_branch
1717;Have you read 'The Alchemist' by Paulo Coelho?;0;58;apart_sea
-1718;I love reading, and I'm always looking for new books to read. Can you recommend any good ones?;22;58;desperate_branch
1719;I highly recommend 'Atomic Habits' by James Clear.;7;58;according_telephone
-1720;I love reading, and I'm always looking for new books to read. Can you recommend any good ones?;22;58;desperate_branch
1721;You might like 'Sapiens' by Yuval Noah Harari.;5;58;used_illegal
-1722;I totally agree! I love starting my day with a run too. It's such a great way to clear your head and get focused for the day ahead.;15;59;lonely_committee
1723;Exactly! I feel so much more productive on days when I run in the morning.;4;59;working_phone
-1724;I totally agree! I love starting my day with a run too. It's such a great way to clear your head and get focused for the day ahead.;15;59;lonely_committee
1725;Me too! I always have so much more energy throughout the day when I start with a run.;8;59;training_round
-1726;I've never been a morning person, so running in the morning just doesn't work for me. I prefer to run in the evening after work.;17;59;crazy_manner
1727;I can see why that would work better for you. Running in the evening is a great way to unwind after a long day.;12;59;healthy_march
-1728;I've never been a morning person, so running in the morning just doesn't work for me. I prefer to run in the evening after work.;17;59;crazy_manner
1729;That makes sense. Everyone has their own preferences when it comes to running.;17;59;mother_bitter
-1730;I've been thinking about starting a running routine but I'm not sure how to get started. Do you have any tips for beginners?;21;59;massive_tooth
1731;Start slow and build up gradually. Don't try to do too much too soon.;14;59;famous_connection
-1732;I've been thinking about starting a running routine but I'm not sure how to get started. Do you have any tips for beginners?;21;59;massive_tooth
1733;Make sure you have the right shoes and clothing. It can make a big difference in your comfort level while running.;12;59;alone_read
-1734;I've been thinking about starting a running routine but I'm not sure how to get started. Do you have any tips for beginners?;21;59;massive_tooth
1735;Find a running buddy if possible. It can be a great motivator.;2;59;afternoon_ideal
-1736;I've heard that running can be hard on your joints. Is that true?;49;59;green_rip
1737;It can be, but there are things you can do to minimize the impact. Make sure you have good shoes and run on a softer surface like a track or grass if possible.;11;59;informal_maybe
-1738;I've heard that running can be hard on your joints. Is that true?;49;59;green_rip
1739;Yes, it can be hard on your joints if you're not careful. Make sure you stretch before and after your runs to help prevent injury.;0;59;otherwise_appearance
-1740;Do you ever get bored with running? How do you keep it interesting?;3;59;separate_pack
1741;Sometimes I do get bored, but I try to mix things up. I'll run different routes or listen to music or podcasts to keep myself entertained.;0;59;training_essay
-1742;Do you ever get bored with running? How do you keep it interesting?;3;59;separate_pack
1743;I like to set goals for myself. It gives me something to work towards and keeps me motivated.;10;59;necessary_airport
-1744;I've been running for a while now and I'm not seeing the results I want. What am I doing wrong?;25;59;brave_male
1745;Make sure you're pushing yourself. If you're not challenging yourself, you won't see results.;13;59;constant_soft
-1746;I've been running for a while now and I'm not seeing the results I want. What am I doing wrong?;25;59;brave_male
1747;You might need to switch up your routine. Try adding in some strength training or changing your diet.;9;59;secure_peace
-1748;I want to start running but I'm not sure how to get motivated. Any tips?;0;59;true_employ
1749;Set a goal for yourself, like running a 5K. It can be a great motivator.;1;59;upset_year
-1750;I want to start running but I'm not sure how to get motivated. Any tips?;0;59;true_employ
1751;Find a friend to run with. It's always more fun when you have someone to share the experience with.;4;59;proper_advertising
-1752;I want to start running but I'm not sure how to get motivated. Any tips?;0;59;true_employ
1753;Make a running playlist with all your favorite songs. It can be a great way to get in the zone.;5;59;sorry_virus
-1754;I completely agree! I started learning French last year and it has opened up so many doors for me.;19;60;good_neat
1755;That's great! How did you start learning?;8;60;whole_plan
-1756;I completely agree! I started learning French last year and it has opened up so many doors for me.;19;60;good_neat
1757;I've always wanted to learn French. Do you have any tips for beginners?;2;60;these_shower
-1758;I don't think learning a new language is worth the effort. It takes too much time and effort and I'd rather focus on other things.;11;60;happy_dance
1759;I understand where you're coming from, but I think the benefits outweigh the effort.;15;60;upstairs_visual
-1760;I don't think learning a new language is worth the effort. It takes too much time and effort and I'd rather focus on other things.;11;60;happy_dance
1761;Everyone has their own priorities and interests.;23;60;crazy_speaker
-1762;Learning a new language is too difficult for me. I tried learning Spanish but I just couldn't get the hang of it.;13;60;round_split
1763;It can be challenging, but with practice and dedication, it's definitely possible!;10;60;western_rip
-1764;Learning a new language is too difficult for me. I tried learning Spanish but I just couldn't get the hang of it.;13;60;round_split
1765;Maybe you just need to try a different approach or find a tutor.;2;60;otherwise_ruin
-1766;I've heard that learning a new language can delay the onset of Alzheimer's disease. Is that true?;23;60;solid_kind
1767;Yes, studies have shown that bilingualism can have a positive impact on cognitive function and may delay the onset of certain age-related brain diseases.;1;60;capable_insurance
-1768;I've heard that learning a new language can delay the onset of Alzheimer's disease. Is that true?;23;60;solid_kind
1769;It's just one of the many benefits of learning a new language.;4;60;inside_mom
-1770;I'm interested in learning a new language but I don't know which one to choose.;24;60;initial_male
1771;It really depends on your interests and goals. Are you looking to travel to a specific country or communicate with a certain group of people?;0;60;apart_laugh
-1772;I'm interested in learning a new language but I don't know which one to choose.;24;60;initial_male
1773;There are many popular languages to choose from, such as Spanish, French, Mandarin, and German.;22;60;pretty_library
-1774;I've been learning English for years but I still struggle with speaking fluently.;28;60;neat_selection
1775;Speaking fluently takes time and practice. Don't get discouraged and keep working at it!;4;60;another_concept
-1776;I've been learning English for years but I still struggle with speaking fluently.;28;60;neat_selection
1777;Have you tried speaking with native speakers or taking a conversation class?;16;60;administrative_elevator
-1778;Learning a new language seems like a lot of work. Are there any shortcuts or easy ways to learn?;8;60;sexual_tour
1779;Unfortunately, there are no shortcuts to learning a new language. It takes time and effort.;6;60;first_juice
-1780;Learning a new language seems like a lot of work. Are there any shortcuts or easy ways to learn?;8;60;sexual_tour
1781;However, there are many resources available, such as language learning apps and online courses, that can make the process easier.;3;60;embarrassed_miss
-1782;I love hiking too! Which mountain did you go to?;33;61;unlikely_familiar
1783;We hiked to Mount Baker in Washington state.;9;61;ok_capital
-1784;I love hiking too! Which mountain did you go to?;33;61;unlikely_familiar
1785;I've always wanted to hike there!;18;61;less_tale
-1786;Hiking can be dangerous. Did you face any challenges during the hike?;35;61;north_egg
1787;We had to cross a river which was quite challenging.;1;61;agent_gather
-1788;Hiking can be dangerous. Did you face any challenges during the hike?;35;61;north_egg
1789;It started raining heavily when we were half-way up.;33;61;correct_fail
-1790;I'm not a big fan of hiking. I prefer staying indoors. But I'm glad you had a good time.;7;61;internal_uncle
1791;That's okay, everyone has their own preferences.;1;61;tough_ad
-1792;I'm not a big fan of hiking. I prefer staying indoors. But I'm glad you had a good time.;7;61;internal_uncle
1793;You should try it sometime, you might like it!;1;61;remote_iron
-1794;I've never been hiking before. How should I prepare for it?;5;61;sorry_glove
1795;Make sure to wear comfortable shoes and clothes.;9;61;all_percentage
-1796;I've never been hiking before. How should I prepare for it?;5;61;sorry_glove
1797;Bring plenty of water and snacks.;15;61;sharp_relationship
-1798;I've never been hiking before. How should I prepare for it?;5;61;sorry_glove
1799;Start with an easy trail and gradually increase the difficulty.;8;61;nasty_criticism
-1800;Hiking is great exercise! Did you feel tired after 8 hours?;9;61;hot_text
1801;Yes, I was exhausted but it was worth it.;17;61;specialist_pull
-1802;Hiking is great exercise! Did you feel tired after 8 hours?;9;61;hot_text
1803;I felt energized and refreshed.;5;61;unusual_climate
-1804;I wish I could go hiking, but I don't have anyone to go with.;2;61;training_league
1805;You can join a hiking group or go alone.;3;61;various_sir
-1806;I wish I could go hiking, but I don't have anyone to go with.;2;61;training_league
1807;I'm planning another hiking trip, you're welcome to join us.;24;61;late_stay
-1808;What's your favorite part about hiking?;33;61;recent_bicycle
1809;I love being surrounded by nature and disconnecting from technology.;9;61;initial_deposit
-1810;What's your favorite part about hiking?;33;61;recent_bicycle
1811;I enjoy the challenge of pushing myself to reach the top.;9;61;remote_grass
-1812;I've always wanted to try yoga. What kind of yoga do you practice?;36;62;reasonable_language
1813;I practice Hatha yoga. It's a slower-paced style that focuses on breathing and alignment.;4;62;active_village
-1814;I've always wanted to try yoga. What kind of yoga do you practice?;36;62;reasonable_language
1815;I practice Vinyasa yoga. It's a more dynamic style that links movement with breath.;0;62;serious_finger
-1816;How often do you practice yoga?;9;62;similar_jury
1817;I try to practice at least three times a week.;4;62;guilty_neck
-1818;How often do you practice yoga?;9;62;similar_jury
1819;I practice yoga every day.;27;62;native_smile
-1820;How often do you practice yoga?;9;62;similar_jury
1821;I practice once a week.;10;62;prior_world
-1822;What are some of the mental benefits you've experienced from practicing yoga?;11;62;beginning_distribution
1823;I feel more focused and present in the moment.;3;62;appropriate_theme
-1824;What are some of the mental benefits you've experienced from practicing yoga?;11;62;beginning_distribution
1825;I feel less stressed and anxious.;2;62;heavy_most
-1826;What are some of the mental benefits you've experienced from practicing yoga?;11;62;beginning_distribution
1827;I feel more connected to my body and my breath.;1;62;general_maximum
-1828;What are some of the mental benefits you've experienced from practicing yoga?;11;62;beginning_distribution
1829;I feel more mindful and aware.;14;62;extreme_vegetable
-1830;Do you think yoga is suitable for everyone?;4;62;still_summer
1831;I think yoga can be adapted for anyone regardless of their age or physical ability.;11;62;rough_understanding
-1832;Do you think yoga is suitable for everyone?;4;62;still_summer
1833;I think it's important to consult a doctor before starting any new exercise program.;6;62;equal_return
-1834;Do you practice yoga at a studio or at home?;11;62;numerous_radio
1835;I practice at a studio because I enjoy the community and the guidance from the teachers.;1;62;double_eye
-1836;Do you practice yoga at a studio or at home?;11;62;numerous_radio
1837;I practice at home because it's more convenient and I can choose my own schedule.;20;62;dry_normal
-1838;What advice would you give to someone who wants to start practicing yoga?;1;62;annual_length
1839;Start slowly and listen to your body.;1;62;anxious_chocolate
