-3122;I completely agree with you. But it's not always easy to maintain a balanced diet. What do you suggest to make it easier?;3;109;proof_bake
3123;Make sure to read food labels and check the nutrition information.;5;109;airline_screw
-3124;I completely agree with you. But it's not always easy to maintain a balanced diet. What do you suggest to make it easier?;3;109;proof_bake
3125;Consult a registered dietitian for personalized advice.;6;109;natural_sound
-3126;I have a busy schedule and find it hard to prepare meals. What are some quick and easy meal options that are still healthy?;26;109;available_mail
3127;Salads are a quick and easy option that can be customized to your taste.;6;109;street_traffic
-3128;I have a busy schedule and find it hard to prepare meals. What are some quick and easy meal options that are still healthy?;26;109;available_mail
3129;Smoothies are a great way to get your daily dose of fruits and vegetables.;9;109;according_advertising
-3130;I have a busy schedule and find it hard to prepare meals. What are some quick and easy meal options that are still healthy?;26;109;available_mail
3131;Grilled chicken or fish with a side of vegetables is a healthy and easy meal.;3;109;sexual_tour
-3132;I have a busy schedule and find it hard to prepare meals. What are some quick and easy meal options that are still healthy?;26;109;available_mail
3133;Snacks such as nuts, fruits, and yogurt are easy to prepare and can be eaten on the go.;16;109;excellent_inspector
-3134;What are some of the most important nutrients that we need to include in our diet?;25;109;some_representative
3135;Protein is essential for building and repairing tissues.;1;109;waste_inspector
-3136;What are some of the most important nutrients that we need to include in our diet?;25;109;some_representative
3137;Carbohydrates provide energy for the body.;5;109;connect_cup
-3138;What are some of the most important nutrients that we need to include in our diet?;25;109;some_representative
3139;Fats are important for brain function and hormone production.;2;109;past_literature
-3140;What are some of the most important nutrients that we need to include in our diet?;25;109;some_representative
3141;Vitamins and minerals are needed in small amounts for various bodily functions.;2;109;purple_credit
-3142;I have heard that certain foods can boost your metabolism. Is that true?;3;109;minute_force
3143;Yes, some foods such as green tea, chili peppers, and whole grains can increase your metabolism.;8;109;big_search
-3144;I have heard that certain foods can boost your metabolism. Is that true?;3;109;minute_force
3145;However, it's important to remember that a healthy diet and regular exercise are the most effective ways to boost your metabolism.;4;109;plus_bite
-3146;What about cheat meals? Is it okay to indulge in unhealthy foods once in a while?;35;109;drunk_car
3147;Yes, it's okay to indulge in your favorite foods once in a while.;3;109;beginning_morning
-3148;What about cheat meals? Is it okay to indulge in unhealthy foods once in a while?;35;109;drunk_car
3149;Just make sure that you balance it out with healthy choices the rest of the time.;14;109;former_wonder
-3150;What about cheat meals? Is it okay to indulge in unhealthy foods once in a while?;35;109;drunk_car
3151;Moderation is key.;13;109;spare_island
-3152;I completely agree with you. Time management is key to achieving success in any area of life. What are some time management strategies that you recommend?;27;110;substantial_north
3153;I find that making a to-do list and prioritizing tasks based on their importance and urgency helps me stay on track.;2;110;strange_people
-3154;I completely agree with you. Time management is key to achieving success in any area of life. What are some time management strategies that you recommend?;27;110;substantial_north
3155;I use the Pomodoro technique to stay focused and productive.;5;110;straight_lesson
-3156;I completely agree with you. Time management is key to achieving success in any area of life. What are some time management strategies that you recommend?;27;110;substantial_north
3157;I schedule my day in advance, including breaks and time for self-care.;3;110;several_video
-3158;I struggle with time management. Any tips for getting started and staying motivated?;5;110;sweet_talk
3159;Start small and focus on one task at a time. Break down larger goals into smaller, more manageable steps.;14;110;car_quiet
-3160;I struggle with time management. Any tips for getting started and staying motivated?;5;110;sweet_talk
3161;Use a timer or app to help you stay on track and hold yourself accountable.;0;110;leading_space
-3162;I struggle with time management. Any tips for getting started and staying motivated?;5;110;sweet_talk
3163;Reward yourself for completing tasks and achieving goals.;2;110;classic_screw
-3164;What do you think are the biggest obstacles to effective time management?;12;110;adult_maximum
3165;Procrastination and distractions are two of the biggest obstacles for me.;8;110;own_self
-3166;What do you think are the biggest obstacles to effective time management?;12;110;adult_maximum
3167;Lack of motivation and unclear goals can also make it difficult to manage time effectively.;1;110;unable_resource
-3168;What do you think are the biggest obstacles to effective time management?;12;110;adult_maximum
3169;Unexpected events or emergencies can throw off our schedules and make it hard to stay on track.;2;110;kitchen_office
-3170;Is it possible to manage time too strictly? Can being too rigid in your schedule actually hinder productivity?;38;110;day_budget
3171;Yes, I think it's important to be flexible and allow for unexpected events or changes in priorities.;5;110;pure_director
-3172;Is it possible to manage time too strictly? Can being too rigid in your schedule actually hinder productivity?;38;110;day_budget
3173;Too much rigidity can lead to burnout and a lack of creativity.;3;110;wild_copy
-3174;Is it possible to manage time too strictly? Can being too rigid in your schedule actually hinder productivity?;38;110;day_budget
3175;It's important to find a balance between structure and flexibility.;11;110;poor_evening
-3176;What do you think is the most important thing to keep in mind when it comes to time management?;6;110;heavy_singer
3177;Remember that time is a finite resource and prioritize your tasks accordingly.;2;110;wooden_current
-3178;What do you think is the most important thing to keep in mind when it comes to time management?;6;110;heavy_singer
3179;Don't forget to make time for self-care and relaxation.;1;110;informal_argument
-3180;What do you think is the most important thing to keep in mind when it comes to time management?;6;110;heavy_singer
3181;Be kind to yourself and don't beat yourself up if you have an off day.;7;110;informal_police
-3182;I also love hiking! Which trail did you go on?;46;111;famous_rice
3183;We went on the Blue Ridge Trail.;2;111;thin_wear
-3184;I also love hiking! Which trail did you go on?;46;111;famous_rice
3185;That sounds like an amazing experience.;2;111;beautiful_size
-3186;I also love hiking! Which trail did you go on?;46;111;famous_rice
3187;I've never hiked in the mountains before. How difficult was it?;1;111;working_machine
-3188;I'm not a fan of hiking, but I'm glad you had a good time!;6;111;general_club
3189;To each their own, I guess.;4;111;main_grade
-3190;I'm not a fan of hiking, but I'm glad you had a good time!;6;111;general_club
3191;Have you tried hiking before?;5;111;connect_combine
-3192;I'm not a fan of hiking, but I'm glad you had a good time!;6;111;general_club
3193;Maybe you just haven't found the right trail yet.;0;111;downtown_reputation
-3194;Did you encounter any wildlife on your hike?;21;111;select_storm
3195;We saw a few deer and some birds.;5;111;visible_meal
-3196;Did you encounter any wildlife on your hike?;21;111;select_storm
3197;I'm always afraid of running into a bear!;1;111;loud_dirt
-3198;Did you encounter any wildlife on your hike?;21;111;select_storm
3199;I love seeing wildlife when I'm out in nature.;21;111;loud_strength
-3200;Do you have any tips for someone who's never been hiking before?;7;111;prior_hair
3201;Start with an easy trail and work your way up.;2;111;upset_room
-3202;Do you have any tips for someone who's never been hiking before?;7;111;prior_hair
3203;Make sure you have comfortable shoes and plenty of water.;8;111;after_subject
-3204;Do you have any tips for someone who's never been hiking before?;7;111;prior_hair
3205;Don't forget to bring sunscreen and bug spray!;1;111;other_hit
-3206;I wish I could go hiking, but I don't have anyone to go with.;12;111;eastern_position
3207;You could try joining a hiking group!;4;111;horror_flight
-3208;I wish I could go hiking, but I don't have anyone to go with.;12;111;eastern_position
3209;Maybe ask some friends or family members if they'd like to go with you?;0;111;other_battle
-3210;I wish I could go hiking, but I don't have anyone to go with.;12;111;eastern_position
3211;Sometimes it's nice to go solo and just enjoy the peace and quiet.;4;111;specific_job
-3212;I'm not sure if hiking is for me, but I'd love to try camping sometime!;26;111;appropriate_buy
3213;Camping can be a lot of fun!;14;111;tight_remove
-3214;I'm not sure if hiking is for me, but I'd love to try camping sometime!;26;111;appropriate_buy
3215;Just make sure you bring enough supplies.;5;111;chicken_obligation
-3216;I'm not sure if hiking is for me, but I'd love to try camping sometime!;26;111;appropriate_buy
3217;Where would you like to go camping?;3;111;educational_sock
-3218;I love hiking, but I always get blisters on my feet. Any advice?;8;111;that_year
3219;Make sure your shoes fit properly and wear socks that wick away moisture.;5;111;tiny_extreme
-3220;I love hiking, but I always get blisters on my feet. Any advice?;8;111;that_year
3221;Try using moleskin to prevent blisters from forming.;10;111;accurate_search
-3222;I love hiking, but I always get blisters on my feet. Any advice?;8;111;that_year
3223;Make sure to break in your shoes before you go on a long hike.;0;111;funny_nurse
-3224;I totally agree that learning a second language is beneficial. What language are you currently learning?;8;112;known_difficulty
3225;I'm learning Spanish.;6;112;secure_raise
-3226;I totally agree that learning a second language is beneficial. What language are you currently learning?;8;112;known_difficulty
3227;I'm also learning Spanish!;8;112;smart_aside
-3228;I totally agree that learning a second language is beneficial. What language are you currently learning?;8;112;known_difficulty
3229;I'm learning French.;9;112;most_priority
-3230;I totally agree that learning a second language is beneficial. What language are you currently learning?;8;112;known_difficulty
3231;I'm interested in learning Mandarin.;6;112;famous_gather
-3232;I think learning a second language is overrated. There are plenty of successful people who only speak one language.;9;112;thin_strip
3233;While that may be true, learning a second language can still have personal benefits even if it doesn't lead to career success.;8;112;wooden_fat
-3234;I think learning a second language is overrated. There are plenty of successful people who only speak one language.;9;112;thin_strip
3235;I see your point, but being bilingual can also be a huge asset in today's global economy.;11;112;tight_afternoon
-3236;I'm interested in learning a second language, but I don't know where to start. Do you have any recommendations?;22;112;fat_tomorrow
3237;There are a lot of great language learning apps and websites out there like Duolingo and Babbel.;5;112;separate_pack
-3238;I'm interested in learning a second language, but I don't know where to start. Do you have any recommendations?;22;112;fat_tomorrow
3239;I recommend finding a language exchange partner so you can practice speaking with a native speaker.;2;112;constant_traffic
-3240;I'm interested in learning a second language, but I don't know where to start. Do you have any recommendations?;22;112;fat_tomorrow
3241;I suggest taking a language class at a local community college.;17;112;business_sink
-3242;I already speak two languages fluently, and I'm considering learning a third. Do you think it's worth the time and effort?;32;112;straight_emotion
3243;Absolutely! Learning a third language can open up even more opportunities and give you a deeper understanding of different cultures.;13;112;leather_knee
-3244;I already speak two languages fluently, and I'm considering learning a third. Do you think it's worth the time and effort?;32;112;straight_emotion
3245;Go for it! Learning a new language is always a valuable experience.;3;112;national_release
-3246;I tried learning a second language before, but I found it too difficult. Any tips for staying motivated?;15;112;fresh_press
3247;Try setting small goals for yourself and celebrating each accomplishment along the way.;14;112;general_mistake
-3248;I tried learning a second language before, but I found it too difficult. Any tips for staying motivated?;15;112;fresh_press
3249;Find something you enjoy in the language you're learning, like a favorite TV show or music artist.;12;112;business_benefit
-3250;I tried learning a second language before, but I found it too difficult. Any tips for staying motivated?;15;112;fresh_press
3251;Remember why you started and keep the benefits of learning a second language in mind.;13;112;mobile_confusion
-3252;I'm a teacher and I want to encourage my students to learn a second language. What can I do to make language learning more engaging for them?;8;112;which_ruin
3253;Incorporate games and activities into your lessons that make learning a second language fun.;21;112;mobile_whereas
-3254;I'm a teacher and I want to encourage my students to learn a second language. What can I do to make language learning more engaging for them?;8;112;which_ruin
3255;Plan a virtual exchange with students in another country so they can practice speaking with native speakers.;18;112;purple_department
-3256;I'm a teacher and I want to encourage my students to learn a second language. What can I do to make language learning more engaging for them?;8;112;which_ruin
3257;Highlight the cultural aspects of the language you're teaching to make it more interesting for your students.;0;112;exact_dump
-3258;I've been playing tennis for a while now and I completely agree with you. It's an amazing sport that requires a lot of skill and strategy. Did you have any difficulties while playing?;37;113;minute_strategy
3259;Yes, I had a hard time hitting the ball consistently.;1;113;wooden_drag
-3260;I've been playing tennis for a while now and I completely agree with you. It's an amazing sport that requires a lot of skill and strategy. Did you have any difficulties while playing?;37;113;minute_strategy
3261;No, I found it to be surprisingly easy.;5;113;leading_media
-3262;I've never played tennis before, but it sounds like something I'd love to try. What advice do you have for beginners?;23;113;overall_environment
3263;Try to focus on your footwork and positioning.;12;113;joint_star
-3264;I've never played tennis before, but it sounds like something I'd love to try. What advice do you have for beginners?;23;113;overall_environment
3265;Start with practicing your serve.;6;113;airline_time
-3266;I've never played tennis before, but it sounds like something I'd love to try. What advice do you have for beginners?;23;113;overall_environment
3267;Try to find a good coach or partner to practice with.;13;113;yellow_importance
-3268;Tennis is such a great way to stay active and healthy. Have you considered playing more often?;0;113;impressive_heat
3269;Yes, I definitely plan on playing more in the future.;11;113;left_drive
-3270;Tennis is such a great way to stay active and healthy. Have you considered playing more often?;0;113;impressive_heat
3271;No, I think I'll stick to other sports.;2;113;rough_fold
-3272;Tennis is such a great way to stay active and healthy. Have you considered playing more often?;0;113;impressive_heat
3273;I'm not sure yet, but I'll definitely keep it in mind.;7;113;any_homework
-3274;I used to play tennis a lot when I was younger. It's great to see people still enjoying the sport. How did you feel after playing for the first time?;4;113;loud_cancer
3275;I was exhausted but also excited to play again.;17;113;stupid_love
-3276;I used to play tennis a lot when I was younger. It's great to see people still enjoying the sport. How did you feel after playing for the first time?;4;113;loud_cancer
3277;I felt like I had a great workout.;3;113;extra_rush
-3278;I used to play tennis a lot when I was younger. It's great to see people still enjoying the sport. How did you feel after playing for the first time?;4;113;loud_cancer
3279;I was a little sore but it was worth it.;0;113;busy_idea
-3280;I've always wanted to try tennis but never had the opportunity. How did you get into it?;33;113;ill_salary
3281;A friend invited me to play with them.;1;113;thick_independence
-3282;I've always wanted to try tennis but never had the opportunity. How did you get into it?;33;113;ill_salary
3283;I signed up for lessons at a local club.;3;113;latter_disk
-3284;I've always wanted to try tennis but never had the opportunity. How did you get into it?;33;113;ill_salary
3285;I just picked up a racket and started hitting the ball around.;0;113;remarkable_bridge
-3286;What was the most challenging part of playing tennis for you?;24;113;strange_train
3287;Keeping my eye on the ball.;4;113;east_dead
-3288;What was the most challenging part of playing tennis for you?;24;113;strange_train
3289;Trying to hit a backhand shot.;2;113;pretend_remove
-3290;What was the most challenging part of playing tennis for you?;24;113;strange_train
3291;Getting the ball to go where I wanted it to.;10;113;gold_wave
-3292;I'm not a big fan of tennis, but I'm glad you enjoyed yourself. What other sports do you like to play?;27;113;this_shoot
3293;I enjoy playing basketball and soccer.;3;113;mission_pattern
-3294;I'm not a big fan of tennis, but I'm glad you enjoyed yourself. What other sports do you like to play?;27;113;this_shoot
3295;I'm a big fan of volleyball and swimming.;6;113;perfect_pass
-3296;I'm not a big fan of tennis, but I'm glad you enjoyed yourself. What other sports do you like to play?;27;113;this_shoot
3297;I like to play golf and go hiking.;8;113;remote_representative
-3298;I've always wanted to go to Japan! What was your favorite part of the trip?;22;114;public_trick
3299;Definitely the food. I tried so many new things and everything was delicious.;6;114;federal_struggle
-3300;I've always wanted to go to Japan! What was your favorite part of the trip?;22;114;public_trick
3301;I loved visiting the temples and experiencing the culture.;6;114;medical_dead
-3302;How was the language barrier? Did you have any trouble communicating with the locals?;32;114;curious_head
3303;It was a bit challenging at times, but most people were very friendly and patient with us.;2;114;simple_shelter
-3304;How was the language barrier? Did you have any trouble communicating with the locals?;32;114;curious_head
3305;We used a translation app to help us communicate and it worked pretty well.;9;114;sensitive_figure
-3306;I've heard that Japan can be expensive. How much did you spend on your trip?;7;114;born_homework
3307;It was definitely more expensive than some of my other trips, but we were able to save money by staying in hostels and eating at more affordable places.;7;114;some_size
-3308;I've heard that Japan can be expensive. How much did you spend on your trip?;7;114;born_homework
3309;We budgeted carefully and were able to keep our costs down.;16;114;obvious_recipe
-3310;I'm planning a trip to Japan next year. Do you have any tips or recommendations?;5;114;party_industry
3311;Definitely try the ramen and sushi! And make sure to visit some of the temples and gardens.;3;114;enough_unique
-3312;I'm planning a trip to Japan next year. Do you have any tips or recommendations?;5;114;party_industry
3313;If you're interested in technology, visit Akihabara in Tokyo for all things electronics.;4;114;unable_resource
-3314;I'm planning a trip to Japan next year. Do you have any tips or recommendations?;5;114;party_industry
3315;Consider getting a JR Pass for unlimited train travel.;0;114;happy_position
-3316;I've been to Japan before and I agree, it's an amazing country. Where did you visit?;44;114;fresh_consideration
3317;We visited Tokyo, Kyoto, and Osaka. Each city had its own unique charm.;6;114;happy_menu
-3318;I've been to Japan before and I agree, it's an amazing country. Where did you visit?;44;114;fresh_consideration
3319;We also visited some smaller towns and villages and it was a great way to see a different side of Japan.;0;114;far_upper
-3320;I've heard that Japan can be overwhelming for first-time visitors. Did you experience any culture shock?;8;114;neither_face
3321;There were definitely some things that were different from what I'm used to, but overall I didn't experience much culture shock.;14;114;period_birth
-3322;I've heard that Japan can be overwhelming for first-time visitors. Did you experience any culture shock?;8;114;neither_face
3323;I did some research and tried to prepare myself before the trip, which helped a lot.;7;114;high_order
-3324;I'm glad you had a great time in Japan! Do you plan on visiting again?;24;114;general_homework
3325;Absolutely! There's still so much more I want to see and experience in Japan.;6;114;general_chain
-3326;I'm glad you had a great time in Japan! Do you plan on visiting again?;24;114;general_homework
3327;I would love to visit during cherry blossom season.;7;114;amazing_hide
-3328;I love hiking too! Do you have a favorite trail?;1;115;incident_combine
3329;Yes, my favorite trail is the one that leads up to the peak of a nearby mountain. The views are amazing from the top.;11;115;agent_solution
-3330;I love hiking too! Do you have a favorite trail?;1;115;incident_combine
3331;I love hiking, but I'm not sure I have a favorite trail. There are so many great ones to choose from.;17;115;ideal_instruction
-3332;I've always wanted to try camping, but I don't know where to start. Do you have any tips?;40;115;able_leadership
3333;Make sure you have a good tent and sleeping bag. Also, bring plenty of food and water. And don't forget to bring a first aid kit!;5;115;which_independence
-3334;I've always wanted to try camping, but I don't know where to start. Do you have any tips?;40;115;able_leadership
3335;Start by camping in a local state park. They usually have all the amenities you need and are a great place to start.;4;115;dry_block
-3336;I'm not really into outdoor activities, but I do like to fish occasionally. What kind of fish do you like to catch?;18;115;dramatic_ride
3337;I like to catch trout and bass.;4;115;such_hire
-3338;I'm not really into outdoor activities, but I do like to fish occasionally. What kind of fish do you like to catch?;18;115;dramatic_ride
3339;I usually go for catfish or bluegill.;7;115;unable_region
-3340;I'm not really into outdoor activities, but I do like to fish occasionally. What kind of fish do you like to catch?;18;115;dramatic_ride
3341;I like to catch salmon when I go fishing in the Pacific Northwest.;15;115;wise_outcome
-3342;I've never been camping or hiking before, but I really want to try it. What are some good beginner trails and campsites?;0;115;house_press
3343;Some good beginner trails include the Appalachian Trail, the Pacific Crest Trail, and the Colorado Trail.;7;115;significant_physics
-3344;I've never been camping or hiking before, but I really want to try it. What are some good beginner trails and campsites?;0;115;house_press
3345;Some good beginner campsites include national and state parks. They usually have all the amenities you need and are a great place to start.;7;115;realistic_bicycle
-3346;I love fishing too! Have you ever tried fly fishing?;29;115;automatic_limit
3347;Yes, I have. It's a lot of fun!;12;115;current_reveal
-3348;I love fishing too! Have you ever tried fly fishing?;29;115;automatic_limit
3349;No, I haven't. But I've always wanted to try it.;12;115;such_finger
-3350;I love fishing too! Have you ever tried fly fishing?;29;115;automatic_limit
3351;I've tried it a few times, but I'm not very good at it.;12;115;certain_active
-3352;I'm not really into outdoor activities, but I do like to take walks in the park. Do you have any favorite parks?;8;115;foreign_milk
3353;Yes, my favorite park is Central Park in New York City.;3;115;helpful_benefit
-3354;I'm not really into outdoor activities, but I do like to take walks in the park. Do you have any favorite parks?;8;115;foreign_milk
3355;I like to walk in my local park. It's not as big as some of the other parks, but it's still nice.;2;115;helpful_staff
-3356;I'm not really into outdoor activities, but I do like to take walks in the park. Do you have any favorite parks?;8;115;foreign_milk
3357;I don't have a favorite park, but I like to explore new ones whenever I can.;17;115;substantial_skin
-3358;I love camping and hiking! Have you ever done any backcountry camping?;27;115;basic_subject
3359;Yes, I have. It's a lot of fun, but you have to be prepared.;2;115;royal_grass
-3360;I love camping and hiking! Have you ever done any backcountry camping?;27;115;basic_subject
3361;No, I haven't. But I've always wanted to try it.;5;115;previous_pen
-3362;I love camping and hiking! Have you ever done any backcountry camping?;27;115;basic_subject
3363;I've done a little bit of backcountry camping, but I'm not very experienced.;1;115;adult_concert
-3364;I've been a vegetarian for a few years now and I can definitely attest to the health benefits. Have you noticed any other changes since switching to a plant-based diet?;8;116;top_night
