-4380;I used to love hiking, but I injured my knee a few years ago and haven't been able to go since. Do you have any tips for people with knee problems?;16;149;new_nothing
4381;You can try using trekking poles to help support your knees.;7;149;dear_interest
-4382;I used to love hiking, but I injured my knee a few years ago and haven't been able to go since. Do you have any tips for people with knee problems?;16;149;new_nothing
4383;Make sure to wear proper hiking shoes with good support.;0;149;frequent_care
-4384;I used to love hiking, but I injured my knee a few years ago and haven't been able to go since. Do you have any tips for people with knee problems?;16;149;new_nothing
4385;There are also knee braces and compression sleeves that can help.;0;149;key_top
-4386;I love the views when hiking, but sometimes the bugs can be really annoying. How do you deal with them?;31;149;southern_mess
4387;I usually bring bug spray with me.;6;149;many_county
-4388;I love the views when hiking, but sometimes the bugs can be really annoying. How do you deal with them?;31;149;southern_mess
4389;Wearing long sleeves and pants can help prevent bug bites.;3;149;corner_report
-4390;I love the views when hiking, but sometimes the bugs can be really annoying. How do you deal with them?;31;149;southern_mess
4391;You can also try using natural bug repellents like citronella or lavender oil.;21;149;complex_frame
-4392;I prefer other outdoor activities like camping or fishing, but I'm curious about hiking. What should I bring on my first hike?;11;149;background_green
4393;Make sure to bring plenty of water and snacks.;3;149;final_dish
-4394;I prefer other outdoor activities like camping or fishing, but I'm curious about hiking. What should I bring on my first hike?;11;149;background_green
4395;Wear sunscreen and a hat to protect your skin from the sun.;0;149;hour_calm
-4396;I prefer other outdoor activities like camping or fishing, but I'm curious about hiking. What should I bring on my first hike?;11;149;background_green
4397;Don't forget a map or a GPS device in case you get lost.;9;149;day_crack
-4398;I love hiking too, but I always struggle with the uphill climbs. How do you keep yourself motivated?;8;149;cultural_score
4399;I like to set small goals for myself, like reaching a certain landmark.;4;149;tiny_single
-4400;I love hiking too, but I always struggle with the uphill climbs. How do you keep yourself motivated?;8;149;cultural_score
4401;Listening to music or podcasts can help distract from the difficulty.;4;149;human_mail
-4402;I love hiking too, but I always struggle with the uphill climbs. How do you keep yourself motivated?;8;149;cultural_score
4403;Take breaks when you need to and enjoy the view.;13;149;apart_advantage
-4404;I'm not really into hiking, but I can see why people enjoy it. Do you think it's important to connect with nature?;0;149;extra_variation
4405;I think it's important for our mental health to take breaks from technology and city life.;3;149;common_line
-4406;I'm not really into hiking, but I can see why people enjoy it. Do you think it's important to connect with nature?;0;149;extra_variation
4407;Being in nature can help us appreciate the beauty of the world around us.;6;149;significant_loss
-4408;I'm not really into hiking, but I can see why people enjoy it. Do you think it's important to connect with nature?;0;149;extra_variation
4409;It's also important to take care of our planet and preserving natural areas by supporting conservation efforts.;17;149;latter_rate
-4410;I've always wanted to try skydiving, but I'm too scared. How did you manage to overcome your fear?;12;150;common_spend
4411;Honestly, I was nervous too. But I reminded myself that thousands of people skydive safely every day, and that helped me calm down.;0;150;kitchen_bunch
-4412;I've always wanted to try skydiving, but I'm too scared. How did you manage to overcome your fear?;12;150;common_spend
4413;I went with a group of friends which made it easier to take the leap.;2;150;equivalent_contract
-4414;That sounds amazing! I've been skydiving before and it's definitely a rush like no other.;7;150;several_negotiation
4415;Agreed! I love the feeling of being up in the sky and the adrenaline rush that comes with it.;1;150;difficult_order
-4416;That sounds amazing! I've been skydiving before and it's definitely a rush like no other.;7;150;several_negotiation
4417;It's a once-in-a-lifetime experience that everyone should try at least once.;0;150;guilty_arm
-4418;I'm not sure if I could ever do it. How did you feel once you landed on the ground?;7;150;drunk_phrase
4419;I felt an incredible sense of accomplishment and pride. It was definitely a moment that I'll never forget.;20;150;famous_rice
-4420;I'm not sure if I could ever do it. How did you feel once you landed on the ground?;7;150;drunk_phrase
4421;My adrenaline was still pumping even after I landed, so I felt a little shaky but also really happy.;18;150;useful_pin
-4422;I've heard that skydiving can be dangerous. Were you scared at all during the experience?;15;150;motor_phrase
4423;There's always some level of risk involved with any extreme sport, but I felt safe because I went with a reputable skydiving company that had experienced instructors.;10;150;easy_stuff
-4424;I've heard that skydiving can be dangerous. Were you scared at all during the experience?;15;150;motor_phrase
4425;I trusted my instructor and felt confident that everything would go smoothly.;1;150;high_swing
-4426;I don't think I could ever do something like that. What other extreme sports have you tried?;10;150;natural_property
4427;I've also been bungee jumping, white water rafting, and ziplining. I love trying new things and pushing myself out of my comfort zone!;19;150;suspicious_focus
-4428;I don't think I could ever do something like that. What other extreme sports have you tried?;10;150;natural_property
4429;I've tried rock climbing and paragliding. It's always scary at first, but the feeling of accomplishment afterwards is worth it.;1;150;vegetable_tip
-4430;That sounds like an amazing experience! I'm so jealous. How much did it cost?;5;150;budget_definition
4431;It was a bit expensive, but worth every penny. I paid $300 for the jump and video package.;13;150;strong_pension
-4432;That sounds like an amazing experience! I'm so jealous. How much did it cost?;5;150;budget_definition
4433;It wasn't cheap, but I saved up for a few months so that I could afford it. It was definitely worth the cost.;1;150;sad_phase
-4434;What recipe did you make?;2;151;mad_platform
4435;I made a chicken parmesan dish.;4;151;healthy_woman
-4436;What recipe did you make?;2;151;mad_platform
4437;It was a lasagna recipe that I tweaked a bit.;10;151;ready_feed
-4438;What recipe did you make?;2;151;mad_platform
4439;I made a vegetarian curry recipe.;6;151;cute_save
-4440;Can you share the recipe with us?;11;151;remote_iron
4441;Sure, here's the link to the recipe:;11;151;dirty_offer
-4442;Can you share the recipe with us?;11;151;remote_iron
4443;I can share the recipe with you. It's actually really simple.;0;151;tall_frame
-4444;Can you share the recipe with us?;11;151;remote_iron
4445;I would love to try making it myself. Could you share the recipe?;13;151;strange_lock
-4446;Did you make any changes to the recipe?;42;151;happy_dance
4447;Yes, I added some extra spices to give it a bit more flavor.;21;151;exciting_stand
-4448;Did you make any changes to the recipe?;42;151;happy_dance
4449;I substituted some of the ingredients because I didn't have them on hand.;17;151;dead_document
-4450;Did you make any changes to the recipe?;42;151;happy_dance
4451;I added some vegetables to make it a little healthier.;12;151;dead_session
-4452;Do you enjoy cooking?;15;151;practical_length
4453;Yes, I love trying out new recipes and experimenting in the kitchen.;2;151;negative_opposite
-4454;Do you enjoy cooking?;15;151;practical_length
4455;I don't really like cooking, but I do it because I have to.;8;151;either_dot
-4456;Do you enjoy cooking?;15;151;practical_length
4457;I enjoy cooking, but I don't have a lot of time to do it.;25;151;different_gate
-4458;What's your favorite type of cuisine to cook?;13;151;initial_sandwich
4459;I love cooking Italian food.;4;151;complex_disaster
-4460;What's your favorite type of cuisine to cook?;13;151;initial_sandwich
4461;I enjoy making Asian-inspired dishes.;8;151;special_serve
-4462;What's your favorite type of cuisine to cook?;13;151;initial_sandwich
4463;I like to experiment with fusion cuisine.;12;151;tough_face
-4464;What other recipes do you want to try?;20;151;opposite_kill
4465;I want to try making homemade pasta from scratch.;0;151;vegetable_can
-4466;What other recipes do you want to try?;20;151;opposite_kill
4467;I've been wanting to try making a souffle for a while now.;4;151;former_song
-4468;What other recipes do you want to try?;20;151;opposite_kill
4469;I want to learn how to make sushi.;10;151;federal_piano
-4470;Do you have any cooking tips to share?;1;151;major_release
4471;Always read the recipe thoroughly before you start.;20;151;gross_cookie
-4472;Do you have any cooking tips to share?;1;151;major_release
4473;Don't be afraid to make substitutions or changes to the recipe.;4;151;both_if
-4474;Do you have any cooking tips to share?;1;151;major_release
4475;Make sure to taste as you go and adjust seasonings as needed.;6;151;foreign_film
-4476;I've always wanted to see them live! What was your favorite song that they played?;3;152;educational_wedding
4477;Definitely 'Stairway to Heaven.' It was even better live than I imagined.;20;152;objective_tennis
-4478;I've always wanted to see them live! What was your favorite song that they played?;3;152;educational_wedding
4479;I really liked 'Kashmir.' It was such a powerful performance.;8;152;dear_pizza
-4480;I've always wanted to see them live! What was your favorite song that they played?;3;152;educational_wedding
4481;I couldn't pick just one favorite! The whole concert was amazing.;10;152;direct_cloud
-4482;I'm not a fan of that band, but I'm glad you had a great time!;6;152;trick_branch
4483;Thanks! I understand they're not for everyone.;3;152;pleasant_father
-4484;I'm not a fan of that band, but I'm glad you had a great time!;6;152;trick_branch
4485;It's okay, different people have different tastes.;6;152;perfect_society
-4486;How was the venue? Was it crowded?;26;152;interesting_hair
4487;The venue was great! It was spacious and had great acoustics.;0;152;express_bear
-4488;How was the venue? Was it crowded?;26;152;interesting_hair
4489;It was a bit crowded, but I was still able to enjoy the show.;7;152;wide_cross
-4490;Do you think you'll go to another concert soon?;21;152;holiday_priority
4491;Definitely! I'm already looking forward to the next one.;7;152;budget_deep
-4492;Do you think you'll go to another concert soon?;21;152;holiday_priority
4493;Maybe not right away, but I would love to see more live music in the future.;8;152;unique_library
-4494;I wish I could have gone to that concert, but I couldn't get tickets.;16;152;boring_cycle
4495;Yeah, tickets sold out really fast.;8;152;incident_structure
-4496;I wish I could have gone to that concert, but I couldn't get tickets.;16;152;boring_cycle
4497;That's too bad. Maybe next time!;1;152;each_idea
-4498;Do you have any recommendations for similar bands I should check out?;28;152;beautiful_building
4499;You might like 'Led Zeppelin' or 'Pink Floyd.' They have a similar sound.;9;152;hard_profit
-4500;Do you have any recommendations for similar bands I should check out?;28;152;beautiful_building
4501;You should definitely check out 'The Who' or 'Black Sabbath.' They're both amazing.;1;152;narrow_cry
-4502;Do you have any recommendations for similar bands I should check out?;28;152;beautiful_building
4503;I think you'll love 'Deep Purple' or 'Queen.' They're both classic bands.;3;152;sad_box
-4504;I've never been to a concert before. Is it really that amazing?;18;152;numerous_shoe
4505;Yes, absolutely! The energy and atmosphere are unlike anything else.;3;152;foreign_situation
-4506;I've never been to a concert before. Is it really that amazing?;18;152;numerous_shoe
4507;Definitely! It's a great way to experience music in a whole new way.;2;152;financial_command
-4508;I've never been to a concert before. Is it really that amazing?;18;152;numerous_shoe
4509;You have to go to one and experience it for yourself!;2;152;mental_performance
-4510;I completely agree with you. I try to exercise at least three times a week and I feel so much better when I do.;3;153;home_remote
4511;That's great! What kind of exercises do you usually do?;10;153;constant_morning
-4512;I completely agree with you. I try to exercise at least three times a week and I feel so much better when I do.;3;153;home_remote
4513;I also try to exercise regularly. It's amazing how much of a difference it can make.;7;153;winter_security
-4514;I know exercise is important, but I just can't seem to find the motivation to do it.;27;153;strange_bank
4515;I understand how you feel. Have you tried finding a workout buddy to help keep you accountable?;22;153;mountain_penalty
-4516;I know exercise is important, but I just can't seem to find the motivation to do it.;27;153;strange_bank
4517;Maybe you just haven't found an exercise that you enjoy yet. There are so many different types of exercise to choose from, you're bound to find something that you like.;2;153;master_present
-4518;I think exercise is overrated. I know plenty of people who exercise regularly and still have health problems.;29;153;real_single
4519;While it's true that exercise isn't a cure-all, it can definitely help reduce the risk of chronic diseases. And even if it doesn't completely prevent them, it can still help manage symptoms and improve overall health.;8;153;plus_entry
-4520;I think exercise is overrated. I know plenty of people who exercise regularly and still have health problems.;29;153;real_single
4521;Exercise isn't just about physical health, it's also important for mental health and well-being.;7;153;current_camp
-4522;I'm interested in exercising, but I don't really know where to start. Do you have any advice for beginners?;8;153;political_opposite
4523;It's great that you're interested in starting! I would recommend starting with something simple, like going for a walk or doing some gentle yoga. From there, you can gradually increase the intensity and duration of your workouts.;14;153;mother_bitter
-4524;I'm interested in exercising, but I don't really know where to start. Do you have any advice for beginners?;8;153;political_opposite
4525;You might also consider hiring a personal trainer or taking a group fitness class to help you get started.;8;153;beginning_distribution
-4526;I don't have time to exercise. I work long hours and have a lot of other responsibilities.;26;153;natural_development
4527;I understand that it can be difficult to find time to exercise, but it's important to make it a priority for your health. Even just 20-30 minutes a day can make a big difference.;13;153;winter_mixture
-4528;I don't have time to exercise. I work long hours and have a lot of other responsibilities.;26;153;natural_development
4529;You might also consider finding ways to incorporate exercise into your daily routine, like taking the stairs instead of the elevator or going for a walk during your lunch break.;0;153;short_attention
-4530;I've always wanted to try rock climbing but never got the chance. How high was the wall you climbed?;16;154;legal_tap
4531;It was about 30 feet high.;3;154;official_student
-4532;I've always wanted to try rock climbing but never got the chance. How high was the wall you climbed?;16;154;legal_tap
4533;Same here. It's definitely on my bucket list.;15;154;small_introduction
-4534;Did you have any difficulties while climbing?;14;154;specific_string
4535;Yes, I found it hard to maintain my grip sometimes, but the instructor was very helpful in guiding me through it.;10;154;thin_capital
-4536;Did you have any difficulties while climbing?;14;154;specific_string
4537;I'm afraid I'll get stuck midway and won't be able to move.;18;154;private_peace
-4538;How long did it take for you to climb the wall?;21;154;ready_closet
4539;It took me about 15 minutes.;5;154;opening_entry
-4540;How long did it take for you to climb the wall?;21;154;ready_closet
4541;I heard some people take hours to climb a wall.;5;154;nearby_variety
-4542;Do you plan on going rock climbing again in the future?;61;154;large_coat
4543;Definitely, I already booked another session next week.;0;154;physical_reach
-4544;Do you plan on going rock climbing again in the future?;61;154;large_coat
4545;I'm not sure, but it was definitely a memorable experience.;5;154;direct_carpet
-4546;Do you think rock climbing is a good workout?;33;154;raw_culture
4547;Absolutely, it requires a lot of strength and endurance.;2;154;single_calm
-4548;Do you think rock climbing is a good workout?;33;154;raw_culture
4549;I'm not sure, but it definitely gets your heart racing.;3;154;raw_recording
-4550;What kind of gear did you wear while rock climbing?;6;154;prior_distance
4551;I wore a harness and special shoes designed for rock climbing.;7;154;best_boy
-4552;What kind of gear did you wear while rock climbing?;6;154;prior_distance
4553;I'm not sure, but I heard you need a helmet too.;6;154;free_field
-4554;What other extreme sports have you tried?;13;154;common_line
4555;I haven't tried any other extreme sports yet, but I'm open to suggestions.;9;154;neither_belt
-4556;What other extreme sports have you tried?;13;154;common_line
4557;I've tried bungee jumping and skydiving before.;0;154;dry_hook
-4558;Congratulations! What was the most challenging part of the marathon for you?;23;155;incident_respond
4559;The last few miles were really tough. I was exhausted and my legs were starting to feel heavy.;1;155;fit_income
-4560;Congratulations! What was the most challenging part of the marathon for you?;23;155;incident_respond
4561;For me, it was running up the hills. They really tested my endurance.;0;155;expensive_tone
-4562;How did you prepare for the marathon?;32;155;various_log
4563;I followed a strict training regimen, which included long runs, speed workouts, and strength training.;8;155;suitable_safety
-4564;How did you prepare for the marathon?;32;155;various_log
4565;I made sure to eat a healthy diet and get plenty of rest.;2;155;wrong_vegetable
-4566;Do you have any advice for someone who wants to run a marathon?;29;155;period_day
4567;Make sure to train properly and gradually increase your mileage.;15;155;odd_celebration
-4568;Do you have any advice for someone who wants to run a marathon?;29;155;period_day
4569;Stay hydrated and fuel your body with the right foods.;12;155;status_quote
-4570;Do you have any advice for someone who wants to run a marathon?;29;155;period_day
4571;Don't give up, even when it gets tough.;1;155;male_western
-4572;What was the most memorable part of the marathon?;20;155;overall_area
4573;Crossing the finish line was definitely the most memorable moment for me.;12;155;raw_situation
-4574;What was the most memorable part of the marathon?;20;155;overall_area
4575;I loved the energy of the crowd and the support from the other runners.;9;155;inside_pitch
-4576;How did you feel after the marathon?;1;155;friendly_wind
4577;I was sore and tired, but also incredibly happy and proud of myself.;8;155;exciting_link
-4578;How did you feel after the marathon?;1;155;friendly_wind
4579;I felt a huge sense of accomplishment and couldn't wait to do it again.;7;155;complex_cook
-4580;I've also been learning French! What resources have you been using?;11;156;unhappy_frame
4581;I've been using Duolingo and also taking classes at a local language school.;5;156;subject_till
-4582;I've also been learning French! What resources have you been using?;11;156;unhappy_frame
4583;I've been watching French movies and listening to French music to improve my comprehension.;6;156;little_response
-4584;Learning a new language is so hard! How do you stay motivated?;25;156;kitchen_few
4585;I try to set small goals for myself and celebrate when I achieve them.;14;156;previous_treat
-4586;Learning a new language is so hard! How do you stay motivated?;25;156;kitchen_few
4587;I remind myself why I wanted to learn the language in the first place.;9;156;away_editor
-4588;Have you had a chance to practice speaking with native speakers?;39;156;most_spring
4589;Not yet, but I hope to soon.;11;156;money_document
-4590;Have you had a chance to practice speaking with native speakers?;39;156;most_spring
4591;Yes, I've been practicing with a language exchange partner.;5;156;historical_estate
-4592;I'm interested in learning a new language, but I'm not sure where to start. Any suggestions?;23;156;pleasant_father
4593;Try to find a language learning community, such as a language exchange group or a class.;17;156;smooth_shame
-4594;I'm interested in learning a new language, but I'm not sure where to start. Any suggestions?;23;156;pleasant_father
4595;Start with basic vocabulary and grammar and build from there.;7;156;high_signal
-4596;Learning a new language is a great way to expand your horizons. Have you noticed any other benefits?;10;156;educational_wedding
4597;Yes, I feel like I'm gaining a deeper understanding of French culture and history.;10;156;certain_active
-4598;Learning a new language is a great way to expand your horizons. Have you noticed any other benefits?;10;156;educational_wedding
4599;I've also noticed that my memory and focus have improved.;17;156;actual_might
-4600;I've tried learning a new language before, but I always seem to give up. How do you stay committed?;15;156;according_beach
4601;I try to make language learning a daily habit and not give up when things get difficult.;8;156;savings_touch
-4602;I've tried learning a new language before, but I always seem to give up. How do you stay committed?;15;156;according_beach
4603;I remind myself of my goals and the benefits of learning a new language.;8;156;period_birth
-4604;Do you plan to visit a French-speaking country to practice your language skills?;15;156;distinct_wood
4605;Yes, I'm hoping to visit France next year!;2;156;remote_noise
-4606;Do you plan to visit a French-speaking country to practice your language skills?;15;156;distinct_wood
4607;Not yet, but I would love to.;22;156;acceptable_permission
-4608;I also love basketball! What's your favorite team?;1;157;specific_action
4609;I'm a big fan of the Lakers.;8;157;special_mall
-4610;I also love basketball! What's your favorite team?;1;157;specific_action
4611;I love the Golden State Warriors.;12;157;quiet_context
-4612;I also love basketball! What's your favorite team?;1;157;specific_action
4613;I don't really have a favorite team, I just enjoy watching the game.;4;157;main_skin
-4614;I'm more of a football fan, but I can see why you like basketball.;56;157;fit_interaction
4615;Yeah, football is great too.;5;157;historical_rule
-4616;I'm more of a football fan, but I can see why you like basketball.;56;157;fit_interaction
4617;I enjoy both sports equally.;8;157;funny_mood
-4618;Have you ever played basketball competitively?;3;157;nervous_operation
4619;Yes, I used to play on my high school team.;22;157;spiritual_truck
-4620;Have you ever played basketball competitively?;3;157;nervous_operation
4621;No, I just play for fun with friends.;2;157;equivalent_press
-4622;What's your favorite basketball move?;11;157;then_refrigerator
4623;I love doing crossovers.;12;157;brief_confidence
-4624;What's your favorite basketball move?;11;157;then_refrigerator
4625;My favorite move is the Eurostep.;2;157;tall_pin
-4626;What's your favorite basketball move?;11;157;then_refrigerator
4627;I'm still working on perfecting my jump shot.;3;157;otherwise_leader
-4628;Do you think basketball is a good way to stay in shape?;4;157;own_improvement
4629;Definitely, it's a great workout.;7;157;consistent_mission
-4630;Do you think basketball is a good way to stay in shape?;4;157;own_improvement
4631;It depends on how often you play and how intense the game is.;20;157;difficult_ride
-4632;I'm not really into sports, but I'm glad you enjoy basketball.;31;157;responsible_season
4633;Thanks, it's always good to have a hobby.;3;157;main_magazine
-4634;I'm not really into sports, but I'm glad you enjoy basketball.;31;157;responsible_season
4635;Maybe you'll find a sport you like one day.;28;157;late_clock
-4636;Do you prefer playing basketball indoors or outdoors?;9;157;west_spell
4637;I prefer playing indoors so I don't have to worry about the weather.;10;157;shot_solid
-4638;Do you prefer playing basketball indoors or outdoors?;9;157;west_spell
4639;I like playing outdoors because I feel like it's more natural.;16;157;recent_wealth
-4640;I completely agree! What's your favorite genre to read?;13;158;large_plane
4641;I love reading thrillers and mysteries.;10;158;slow_touch
-4642;I completely agree! What's your favorite genre to read?;13;158;large_plane
4643;I'm more of a non-fiction person myself.;12;158;remote_ladder
-4644;I completely agree! What's your favorite genre to read?;13;158;large_plane
4645;I enjoy romance novels.;11;158;east_independent
-4646;I completely agree! What's your favorite genre to read?;13;158;large_plane
4647;I like to read a little bit of everything.;4;158;time_writing
-4648;I don't have time to read every day. How do you make time for it?;3;158;connect_motor
4649;I set aside a specific time each day for reading, usually before bed.;10;158;plus_present
-4650;I don't have time to read every day. How do you make time for it?;3;158;connect_motor
4651;I listen to audiobooks during my commute or while doing chores.;2;158;excellent_church
-4652;I don't have time to read every day. How do you make time for it?;3;158;connect_motor
